<?xml version="1.0" encoding="UTF-8" standalone="yes"?>
<xs:schema version="1.0" xmlns:xs="http://www.w3.org/2001/XMLSchema">
    <xs:include schemaLocation="../global_types.xsd"/>
    <xs:include schemaLocation="../import.xsd"/>
    <xs:element name="guild_growths">
        <xs:complexType>
            <xs:sequence>
                <xs:element name="guild_growth" type="GuildGrowthTemplate" minOccurs="0" maxOccurs="unbounded"/>
            </xs:sequence>
        </xs:complexType>
    </xs:element>
    <xs:complexType name="GuildGrowthTemplate">
        <xs:attribute name="level" type="xs:int" use="optional"/>
        <xs:attribute name="guild_exp" type="xs:int" use="required"/>
    </xs:complexType>
</xs:schema>